{
  "attempt_record_version": "historical-state-acquisition-v1",
  "attempts": [
    {
      "acquisition_source": "github_current_pr_api",
      "attempt_id": "provider-01",
      "attempt_number": 1,
      "completed_at": "2026-10-01T18:35:11.401501+00:00",
      "exit_status": 0,
      "failure_category": "",
      "operations": [
        "GET https://api.github.com/repos/dotCMS/core/pulls/25432"
      ],
      "retrieval_timestamp": "2026-10-01T18:35:11.401501+00:00",
      "retry_disposition": "not_applicable",
      "started_at": "2026-10-01T18:35:09.848810+00:00",
      "stderr_ref": "",
      "stdout_ref": "cases/reconstruction/CASE_F93FFAA22B9B/logs/provider_attempt_1.json"
    }
  ],
  "case_id": "CASE_F93FFAA22B9B",
  "components": {
    "ci": {
      "evidence_refs": [],
      "status": "not_assessed"
    },
    "discussion": {
      "evidence_refs": [],
      "status": "not_assessed"
    },
    "issue": {
      "evidence_refs": [],
      "status": "not_assessed"
    },
    "pr": {
      "evidence_refs": [
        "cases/reconstruction/CASE_F93FFAA22B9B/evidence/current_pr_metadata_sanitized.json"
      ],
      "status": "available"
    },
    "repository": {
      "evidence_refs": [],
      "status": "unresolved"
    }
  },
  "eligibility_contract_version": "post-stage-c-eligibility-v1",
  "failure_category": "temporal_relation_unresolved",
  "failure_reason": "present_day_pr_base_has_no_qualifying_historical_identity_evidence",
  "historical_state_reconstructible": "unresolved",
  "methodology_version": "dir-tfg-v2",
  "notes": "No acquisition attempted.",
  "object_validation": {
    "deterministic_repeat_validated": false,
    "materialized_state_identifier": "",
    "object_sha": "",
    "object_type": "",
    "parent_shas": [],
    "relationships_validated": false,
    "tree_sha": ""
  },
  "pull_request": {
    "number": 25432,
    "source_linkage_reference": "cases/manifests/screened_PA_PN_cases.csv#CASE_F93FFAA22B9B"
  },
  "reconstruction_contract_version": "post-stage-c-reconstruction-v1",
  "reconstruction_status": "unresolved",
  "repository": {
    "canonical_url": "https://github.com/dotCMS/core",
    "identity": "dotCMS/core"
  },
  "retry_disposition": "not_applicable",
  "scientific_basis": "historical_target_identity_not_established; materialization_not_permitted",
  "stage_c_authority": {
    "path": "cases/conversations/CASE_F93FFAA22B9B/stage_c_extraction_v5.json",
    "sha256": "e376bee29ef91290f8c46d9bb238bf7c82a2aa5ca263d4773d9cd8bf8e4690ae"
  },
  "target_selection": {
    "adjudication": null,
    "authoritative_identifier": "",
    "candidate_identifiers": [
      "9e3357efa8b09dd586c9836650557df4168a59c5"
    ],
    "historical_identity_evidence": [
      {
        "adequate_provenance": true,
        "asserted_base_sha": "9e3357efa8b09dd586c9836650557df4168a59c5",
        "claim_id": "current-pr-base",
        "cross_validated": false,
        "evidence_hash": "f401efb36de9565f02883c91aaf747c03e9bf1e702fee2ebbb3838a7492bf659",
        "evidence_historical_timestamp": "2026-10-01T18:35:11.401501+00:00",
        "evidence_level": "level_4_present_day_pr_metadata",
        "evidence_relation_to_tFG": "after",
        "evidence_source_identifier": "https://api.github.com/repos/dotCMS/core/pulls/25432",
        "evidence_source_type": "current_provider_pr_metadata",
        "evidence_status": "supporting_only",
        "evidence_timestamp_precision": "timestamp",
        "provenance_reference": "cases/reconstruction/CASE_F93FFAA22B9B/evidence/current_pr_metadata_sanitized.json",
        "retrieval_timestamp": "2026-10-01T18:35:11.401501+00:00"
      }
    ],
    "identity_basis": "no_historically_qualifying_target_identity_claim",
    "identity_status": "unresolved",
    "rule": "historically_evidenced_focal_pr_base_state_at_tFG",
    "temporal_evidence": [],
    "type": "git_commit"
  },
  "temporal": {
    "comparison_rule": "historical_timestamp_lte_tFG",
    "primary_repository_cutoff": "tFG",
    "tC": {
      "precision": "timestamp",
      "source": "first developer turn in parsed conversation",
      "status": "derivable",
      "value": "2023-07-07T21:09:50.169989+00:00"
    },
    "tFG": {
      "precision": "timestamp",
      "source": "turn_000003.create_time",
      "status": "derivable",
      "value": "2023-07-07T21:10:15.086839+00:00"
    }
  }
}
